{
  "schema": "riftx.report/v1",
  "generatedAt": 80,
  "llmProfile": {
    "name": "default",
    "protocol": "chatCompletions"
  },
  "autoRun": {
    "state": "succeeded",
    "stopReason": "successCriteriaMet",
    "currentSubgoal": "Validate the attack path",
    "turnsStarted": 3,
    "turnsCompleted": 3,
    "toolCalls": 100,
    "consecutiveFailures": 0,
    "noProgressTurns": 0,
    "unavailableTools": [],
    "limits": {
      "maxTurns": 20,
      "maxToolCalls": 100,
      "maxWallClockSeconds": 3600,
      "maxSingleCommandSeconds": 300,
      "maxConsecutiveFailures": 3,
      "noProgressWindow": 3,
      "maxModelTokensOrCost": null
    },
    "expiresAt": 2000000000,
    "lastGoalAssessment": {
      "evaluatorVersion": "riftx.goal/v1",
      "evaluatedAt": 70,
      "succeeded": true,
      "criteria": [
        {
          "criterionId": "artifact-evidence",
          "satisfied": true,
          "evidenceIds": [
            "evidence-1"
          ]
        }
      ],
      "evidenceIds": [
        "evidence-1"
      ]
    },
    "lastProgressAssessment": null,
    "startedAt": 10,
    "updatedAt": 70
  },
  "limitations": [
    "RiftX executes tools on the local machine; review local tool and Artifact handling accordingly.",
    "The declared target Scope is checked by RiftX policy but is not an OS-enforced network isolation boundary.",
    "User-provided tools may create Artifacts containing sensitive data; review them before export."
  ],
  "engagement": {
    "id": "eng-1",
    "name": "Authorized lab",
    "status": "active",
    "objective": {
      "summary": "Validate an authorized attack path",
      "successCriteria": [
        "Preserve reproducible evidence"
      ],
      "structuredCriteria": [
        {
          "id": "artifact-evidence",
          "description": "Preserve one artifact-backed evidence item",
          "predicate": {
            "type": "evidence",
            "minimumItems": 1,
            "reproductionRequired": true
          }
        }
      ]
    },
    "entryPoints": [
      "10.10.20.10"
    ],
    "mode": "auto",
    "llmProfile": "default",
    "autoLimits": null,
    "authorization": {
      "network": {
        "cidrs": [
          "10.10.20.0/24"
        ],
        "domains": [],
        "ports": [
          445
        ]
      },
      "identities": [],
      "capabilities": [
        "attack_path.analysis"
      ],
      "environment": "lab",
      "window": {
        "startsAt": null,
        "expiresAt": 2000000000
      }
    },
    "policyRevision": "revision-1",
    "threadId": null,
    "createdAt": 1,
    "updatedAt": 1
  },
  "assets": [],
  "assetRelations": [],
  "services": [],
  "identities": [],
  "observations": [
    {
      "id": "observation-1",
      "engagementId": "eng-1",
      "subject": {
        "type": "asset",
        "asset_id": "dc-1"
      },
      "executionId": null,
      "source": "local:nuclei",
      "kind": "potentialFinding",
      "summary": "Potential issue requires validation token: [REDACTED]",
      "confidenceBasisPoints": 7000,
      "observedAt": 10
    }
  ],
  "hypotheses": [
    {
      "id": "hypothesis-1",
      "engagementId": "eng-1",
      "observationIds": [
        "observation-1"
      ],
      "statement": "Credential reuse may reach domain control",
      "status": "proposed",
      "confidenceBasisPoints": 6000,
      "createdAt": 20
    }
  ],
  "testCases": [
    {
      "id": "test-1",
      "engagementId": "eng-1",
      "hypothesisId": "hypothesis-1",
      "target": {
        "type": "asset",
        "asset_id": "dc-1"
      },
      "capability": "credentialValidation",
      "expectedEvidence": "Authenticated response",
      "createdAt": 30
    }
  ],
  "executions": [
    {
      "id": "execution-1",
      "engagementId": "eng-1",
      "testCaseId": "test-1",
      "taskId": null,
      "turnId": "turn-1",
      "runner": "native-tool",
      "status": "completed",
      "startedAt": 40,
      "completedAt": 50,
      "exitCode": 0,
      "durationMs": 10000,
      "argv": [
        "nmap",
        "--api-key",
        "[REDACTED]",
        "--password=[REDACTED]",
        "--token-validation",
        "strict",
        "[REDACTED_URL]"
      ],
      "commandSha256": "command-sha256",
      "cwd": "/tmp",
      "processId": null,
      "tool": null,
      "toolInventorySha256": "inventory-sha256",
      "stdoutSha256": "stdout-sha256",
      "stderrSha256": "stderr-sha256",
      "stdinSha256": null,
      "stdoutBytes": 10,
      "stderrBytes": 5,
      "stdinBytes": 0
    }
  ],
  "findings": [
    {
      "id": "finding-1",
      "engagementId": "eng-1",
      "assetId": null,
      "evidenceIds": [
        "evidence-1"
      ],
      "title": "Validated credential reuse",
      "severity": "high",
      "confidenceBasisPoints": 9000,
      "description": "The authorized test reproduced credential reuse",
      "remediation": "Rotate the exposed credential"
    }
  ],
  "evidence": [
    {
      "id": "evidence-1",
      "engagementId": "eng-1",
      "findingId": "finding-1",
      "executionId": "execution-1",
      "artifactId": "artifact-1",
      "summary": "Tool output reproduced the authorized finding",
      "purpose": "objective",
      "reproducible": true,
      "capturedAt": 55
    }
  ],
  "attackPaths": [
    {
      "id": "path-1",
      "engagementId": "eng-1",
      "hops": [
        {
          "source": {
            "type": "identity",
            "identity_id": "identity-1"
          },
          "destination": {
            "type": "asset",
            "asset_id": "dc-1"
          },
          "capability": "credentialReuse",
          "evidenceIds": [
            "evidence-1"
          ]
        }
      ],
      "destinationRole": "domainController",
      "accessLevel": "domainAdminEquivalent",
      "confidenceBasisPoints": 9000,
      "reproducible": true,
      "validatedAt": 60
    }
  ],
  "coverage": [
    {
      "id": "coverage-1",
      "engagementId": "eng-1",
      "dimension": "authorizedAssets",
      "coveredItems": 3,
      "totalItems": 4,
      "evidenceIds": [
        "evidence-1"
      ],
      "measuredAt": 70
    }
  ],
  "tasks": [],
  "artifacts": [
    {
      "id": "artifact-1",
      "engagementId": "eng-1",
      "executionId": "execution-1",
      "path": "artifacts/reproduction.txt",
      "mediaType": "text/plain",
      "sha256": "dddddddddddddddddddddddddddddddddddddddddddddddddddddddddddddddd",
      "sizeBytes": 42,
      "createdAt": 55
    }
  ],
  "approvals": [
    {
      "id": "approval-1",
      "engagementId": "eng-1",
      "kind": "command",
      "requestedAt": 30,
      "decidedAt": 31,
      "requestedDecision": null,
      "outcome": "cancelled",
      "actor": "system",
      "decisionReason": "engagementStopped",
      "policyRevision": "revision-1",
      "executionBindingSha256": "binding-sha256",
      "commandSha256": "command-sha256",
      "argumentSha256": "argument-sha256",
      "displayArgv": [
        "nmap",
        "--private-key",
        "[REDACTED]"
      ],
      "cwd": "/workspace",
      "executableNames": [
        "nmap"
      ]
    }
  ],
  "toolSnapshot": {
    "snapshotSha256": "tool-inventory-sha256",
    "tools": [
      {
        "name": "nmap",
        "sha256": "nmap-sha256",
        "metadataSha256": "nmap-metadata-sha256",
        "metadataSchemaVersion": 1,
        "capabilities": [
          "network.discovery"
        ],
        "risk": "low",
        "managed": true,
        "shadowed": false
      }
    ]
  },
  "skillSnapshot": {
    "snapshotSha256": "skill-catalog-sha256",
    "skills": [
      {
        "name": "authorized-recon",
        "source": "user",
        "enabled": true,
        "sha256": "skill-sha256"
      }
    ]
  }
}
